nama,harga,deskripsi,gambar
PS5 Digital Edition,5500000,"PlayStation 5 Digital Edition baru segel. Garansi resmi Sony Indonesia 1 tahun. Kelengkapan: unit, kabel power, HDMI, controller DualSense, stiker, buku manual.","ps5_1.jpg|ps5_2.jpg"
Nintendo Switch OLED,4800000,"Nintendo Switch model OLED 64GB. Warna Putih. Garansi resmi. Include dock, joy-con pair, grip, charger.","switch_1.jpg|switch_2.jpg"
Xbox Series X,5200000,"Xbox Series X 1TB SSD. Garansi resmi. Include controller, kabel HDMI, power supply.","xbox_1.jpg"
AirPods Pro 2nd Gen,2750000,"AirPods Pro second generation dengan MagSafe Charging Case. ANC aktif. Garansi resmi Apple 1 tahun.","airpods_1.jpg|airpods_2.jpg"
Samsung Galaxy S24 Ultra,18500000,"Samsung Galaxy S24 Ultra 256GB Titanium Gray. Exynos 2400. Garansi SEIN. DIBUKA segel untuk cek unit saja.","s24_1.jpg|s24_2.jpg|s24_3.jpg"
MacBook Air M2,13800000,"MacBook Air M2 chip 8GB/256GB Midnight. Garansi resmi Apple 1 tahun. Kelengkapan lengkap dus.","macbook_1.jpg"
iPad Air M1,8200000,"iPad Air 5th Gen M1 chip 64GB WiFi Starlight. Garansi resmi Apple. Dus lengkap.","ipad_1.jpg|ipad_2.jpg"
Logitech MX Master 3S,1150000,"Mouse wireless Logitech MX Master 3S. Silent click. USB-C charging. Garansi resmi Logitech 3 tahun.","mouse_1.jpg"